{
  "id": "UDR_special_P_Stewart_ivoire_V1",
  "title": "Spécial : Patrick Stewart, 1940-2026",
  "publish": {
    "mode": "live",
    "schedule": "2026-10-29T22:42:00+01:00",
    "linkedin_schedule": "2026-10-29T22:42:00+01:00"
  },
  "media": {
    "vertical": "UDR_special_P_Stewart_ivoire_V1_9x16.mp4",
    "horizontal": "UDR_special_P_Stewart_ivoire_V1_16x9.mp4"
  },
  "posts": {
    "facebook": {
      "media": "horizontal",
      "text": "Patrick Stewart nous a quittés, à 86 ans.\n\nAvant d'être le capitaine Picard et le professeur Xavier, il fut l'un des grands acteurs de la Royal Shakespeare Company. Une voix, un regard, une élégance qui ont traversé soixante ans de théâtre, de télévision et de cinéma.\n\nNous n'ajoutons rien d'autre qu'un visage et deux dates. C'est ce que nous faisons chaque jour, pour des familles qui, elles, n'ont pas de public.\n\n👉 undernierregard.fr\n\nPicard ou Xavier : lequel vous accompagnera ?"
    },
    "instagram": {
      "media": "vertical",
      "text": "Patrick Stewart nous a quittés, à 86 ans.\nShakespeare, le capitaine Picard, le professeur Xavier : soixante ans de scène et d'écran.\nUn dernier regard — les hommages des familles, diffusés par la télévision locale.\n🔗 undernierregard.fr (lien en bio)\n.\n.\n#hommage #mémoire #undernierregard #vosges #aube"
    },
    "tiktok": {
      "media": "vertical",
      "text": "Patrick Stewart, 1940-2026.\nCapitaine Picard. Professeur Xavier.\nUn seul trait, un visage.\nLien en bio.\n#hommage #mémoire #undernierregard #vosges #aube"
    },
    "youtube": {
      "media": "horizontal",
      "title": "Patrick Stewart, 1940-2026 — un dernier regard",
      "text": "Patrick Stewart nous a quittés à 86 ans. Son portrait se dessine d'un seul trait, de la Royal Shakespeare Company à « Star Trek : Picard ».\n\n👉 undernierregard.fr"
    },
    "youtube_shorts": {
      "media": "vertical",
      "title": "Patrick Stewart, 1940-2026 #Shorts",
      "text": "Capitaine Picard, professeur Xavier. Un seul trait, un visage.\n\n👉 undernierregard.fr"
    },
    "linkedin": {
      "media": "horizontal",
      "text": "Patrick Stewart nous a quittés, à 86 ans. De la Royal Shakespeare Company au capitaine Picard, soixante ans d'une carrière d'exception.\n\nChaque jour, nous rendons ce même geste à des personnes que seuls leurs proches connaissaient : un visage, deux dates, diffusés par la télévision locale.\n\nundernierregard.fr"
    },
    "x": {
      "media": "horizontal",
      "text": "Patrick Stewart nous a quittés, à 86 ans. Capitaine Picard, professeur Xavier, et soixante ans de Shakespeare. Un visage d'un seul trait.\nundernierregard.fr"
    },
    "facebook_repere": {
      "media": "horizontal",
      "text": "Patrick Stewart nous a quittés, à 86 ans.\n\nPour des millions de spectateurs, il était le capitaine Picard, celui qui écoutait avant de décider. Il avait aussi parlé publiquement, avec une grande franchise, de la vieillesse et de ce qu'on laisse derrière soi.\n\nUn visage, deux dates : se souvenir commence souvent par là.\n\n👉 reperefuneraire.fr\n\nQuel personnage de fiction vous a accompagné toute une vie ?"
    },
    "facebook_repere_reel": {
      "media": "vertical",
      "text": "Patrick Stewart, 1940-2026. Un seul trait suffit à le reconnaître.\n\n👉 reperefuneraire.fr"
    }
  },
  "founder_comment": "",
  "notes": ""
}